{
  "goal": "Give software delivery a deterministic spine: a supervisor that advances a task through an archetype's steps, dispatches exactly one specialist per step, and validates every artifact against a schema \u2014 so the pipeline's behaviour comes from tested code rather than from prose an agent interprets.",
  "audience": "Teams running agent-assisted development who need the process to be reproducible and auditable rather than improvised per run.",
  "capabilities": [
    "Clarify a PRD into a machine-readable summary and glossary",
    "Break a project into phases with verifiable success criteria, and phases into single-module, single-PR tasks",
    "Advance each task through an archetype's step sequence with a deterministic supervisor",
    "Compose the skills an agent loads from module, language, custom and global layers",
    "Validate every step output against a schema, with a bounded repair loop and an escalation path",
    "Let a specialist report it cannot proceed, rather than failing silently",
    "Gate the steps the archetype declares gated, and route rejections back to the step that can fix them",
    "Summarise a completed phase from its step outputs and record what was learned"
  ],
  "clarifications": [
    {
      "id": "U-1",
      "category": "unknown",
      "question": "Supervisor agent dispatch mechanism: The PRD says the supervisor \"invokes agent with composed skill list\" but does not specify how. Claude Code agents are defined by static `.md` files with fixed skill references. How does the supervisor dynamically pass a different skill list per invocation? Does it rewrite agent files on the fly, inject skill content into the prompt, or rely on a Claude Code feature for dynamic skill loading?",
      "answer": "The supervisor dispatches agents via the Agent tool and includes the skill list in the prompt text. The agent then reads the referenced SKILL.md files itself. Agent definition files list allowed skills, but the supervisor's prompt tells the agent which to load for this specific invocation. No agent file rewriting needed."
    },
    {
      "id": "U-2",
      "category": "unknown",
      "question": "Task-to-module association: Skill resolution depends on knowing which module a task targets (to look up languageId, customSkills, etc.). The PRD does not define a `moduleId` or `targetModule` field on task.json. How is a task linked to its target module?",
      "answer": "task.json includes a targetModule field referencing a module name from modules.json. Carries forward from v1's module field in TASK.md."
    },
    {
      "id": "U-3",
      "category": "unknown",
      "question": "Multi-module skill composition: The cross-module-change archetype exists for tasks spanning multiple modules. But skill resolution (Section 9) is described for a single module. If a task targets module A (Java) and module B (TypeScript), how are skills composed? Union of both language skills? Primary module only? Separate step invocations per module?",
      "answer": "For cross-module-change, the supervisor resolves skills per module separately. The agent receives the union of all language + custom skills from all target modules. If module A is Java and module B is TypeScript, the agent loads: nit:implement + java + typescript + (union of custom skills). The boundary-check step validates cross-module dependencies."
    },
    {
      "id": "U-4",
      "category": "unknown",
      "question": "Greenfield vs. brownfield differences: workspace.json has a mode field (greenfield/brownfield). The PRD describes brownfield analysis and language auto-detection for existing modules. What concretely differs in greenfield mode? Is module registration entirely manual? Does nit:init skip the brownfield scan?",
      "answer": "Greenfield: no brownfield scan, no initial-state.md, modules registered manually via nit:init prompts then expanded as tasks target new paths. Language detection runs on first task targeting a new module. Brownfield: nit:init triggers brownfield scan which auto-populates modules.json."
    },
    {
      "id": "U-5",
      "category": "unknown",
      "question": "nit:clarify output scope: Section 4.1.14 says nit:clarify outputs prd/summary.json and prd/glossary.json. The current v1 nit:clarify produces CLARIFICATIONS.md interactively. Does the v2 nit:clarify replace the interactive clarification flow with JSON output, or does it do both (interactive clarification AND produce summary.json/glossary.json)?",
      "answer": "Both. Interactive clarification stays (core value). After clarification completes, it additionally produces prd/summary.json and prd/glossary.json as structured output for downstream supervisor consumption."
    },
    {
      "id": "U-6",
      "category": "unknown",
      "question": "Step directory numbering with dynamic archetypes: Steps are shown as STEP-001-analyze, STEP-002-design, etc. But archetypes can remove steps (bugfix removes analyze) or add steps (cross-module-change adds boundary-check). Is numbering based on the resolved step list position (so bugfix starts at STEP-001-design), or is there a fixed numbering scheme per step ID?",
      "answer": "Based on resolved step list position. Bugfix starts at STEP-001-design. The step ID (analyze, design, etc.) is in the directory name for readability, numbering is sequential within the task's resolved archetype."
    },
    {
      "id": "U-7",
      "category": "unknown",
      "question": "Repair loop limits: The PRD tracks reopenCount in state.json and describes repair flows when validation fails. Is there a maximum number of repair attempts before the system escalates to the user or halts? If not, an agent could loop indefinitely on a step it cannot fix.",
      "answer": "config/supervisor.json includes maxReopenCount (default: 3). After exceeding the limit, the supervisor stops and escalates to the user with accumulated validation errors."
    },
    {
      "id": "U-8",
      "category": "unknown",
      "question": "Definitive schema list: Section 6 lists 17 artifact types. The directory layout shows ~13 schema files. Some artifact types are \"embedded in step-output\" (analysis-result, design-result, etc.). Do embedded types get their own schema files for validation, or are they validated as part of step-output.schema.json?",
      "answer": "Embedded types validated as part of step-output.schema.json using JSON Schema composition ($defs + $ref). No separate schema files for embedded types. The ~13 standalone schema files cover all non-embedded types."
    },
    {
      "id": "U-9",
      "category": "unknown",
      "question": "Chat context (Claude.ai) support: The NFR states the system works in both Claude.ai chat and Claude Code CLI contexts. However, skills, agents, and hooks are Claude Code features not available in Claude.ai. Is Claude.ai support a real requirement for v2, or is it aspirational/deferred?",
      "answer": "Deferred. Skills/agents/hooks are Claude Code features not available in Claude.ai. v2 targets Claude Code CLI only. Remove Claude.ai from NFRs."
    },
    {
      "id": "U-10",
      "category": "unknown",
      "question": "Phase and task creation interactivity: The PRD lists nit:phases and nit:tasks as commands. In v1 these are interactive (the agent proposes phases/tasks, user approves). Does v2 keep this interactive flow, or do these commands now produce JSON output non-interactively based on prd/summary.json?",
      "answer": "Stays interactive. Agent proposes, user approves. JSON output (phase.json, task.json) replaces Markdown format, but interactive approval flow is preserved."
    },
    {
      "id": "U-11",
      "category": "unknown",
      "question": "Archetype selection mechanism: When creating a task, how is the archetype determined? Does the user explicitly pick it (e.g., \"this is a backend-feature\"), does the analyst propose it during the analyze step, or does the supervisor infer it from tags/modules?",
      "answer": "The analyst proposes the archetype during the analyze step based on task description + target module type. Supervisor validates it's a registered archetype. User can override during the approval gate."
    },
    {
      "id": "R-1",
      "category": "risk",
      "question": "Claude Code dynamic skill loading: The entire layered composition model assumes skills can be dynamically composed per agent invocation. Claude Code's current model loads skills from static agent definition files. If dynamic per-invocation skill loading is not supported, the core architecture may need significant workarounds (e.g., rewriting agent files before each dispatch, or inlining skill content into prompts). Has this been validated against Claude Code's actual capabilities?",
      "answer": "Validated. The Agent tool accepts a freeform prompt where the supervisor lists which skills to load. This is how v1 already works (orchestrator tells agents which skill to run via prompt). Dynamic composition works through prompt instructions, not static agent file rewrites."
    },
    {
      "id": "R-2",
      "category": "risk",
      "question": "jq-based JSON Schema validation: The PRD specifies jq-based validation hooks as the hard guardrail layer. However, jq does not natively support JSON Schema validation ($ref, $defs, pattern, allOf/oneOf, etc.). It can check field existence and types, but full schema validation requires a dedicated tool (e.g., ajv-cli, check-jsonschema). Will the hooks use jq for structural checks only, or is a proper JSON Schema validator expected? This affects the schema complexity that can be enforced.",
      "answer": "jq alone cannot do full JSON Schema validation. Use check-jsonschema (Python) or ajv-cli (Node) for actual schema validation in hooks. jq for structural quick-checks only. Install script verifies the validator is available."
    },
    {
      "id": "R-3",
      "category": "risk",